Shop / Listing,Listing Age (Days),Total Views,Daily Views,Est. Sales,Price,Est. Revenue,Hearts
"LotusLionDigitals:DALL-E Ai Art Prompt Mega Bundle | All-in-One Design Solution for Those Who Use ChatGPT 4 to Create Digital Downloads
ai prompt, cocoatwin, c ustom, good notesplanner, gpt4, prompts, gpts app, clipa rt, temp late, canva frames, cli part, digitable planners, cocoa twins gpt",490,14,0,0,$2.99,$0,3
"JAGDrone:The Psychedelic Scuba - 3 x ai art digital print
Art, Ai, Ai generated, Midjourney, Picture, Colour, Colourful, Scuba, psychadelic",614,9,0,0,$3.98,$0,0
"YouBetYourGlassEtc:Vintage EPNS AI Fish Knives and Forks Lot of 6 - Old Fork and Knife Collectible - Bakelite Handle Fork and Knife - Cutlery
Vintage, fork collectible, knives and forks, vintage knife, fish knife and fork, EPNS AI flatware, vintage flatware, Cutlery",121,0,0,0,$20.00,$0,0
"MSHIHEART:AI Content Creation Service - Ebook
ai ecommerce, AI product, AI for entrepreneurs, e-commerce tips, ai marketing, ai content creation, ai creation, digital marketing, content strategy, AI for business, AI content generator, content automation, AI-driven content",1,0,0,0,$17.25,$0,0
"Minimalist Abstract Art V-Neck Tee, AI generated design, Soft Comfortable Shirt, Unisex Jersey Top, Modern Graphic Tee
Minimalist Art, Abstract Design, Soft Tee, Comfortable Shirt, Unisex V-Neck, Jersey Tee, AI Generated Art, Graphic Tee, V-Neck Shirt, Casual Tee, Everyday Wear, Versatile Top, Artistic Tee",1,0,0,0,$21.99,$0,0
"ADBookCoverModels:Kat - AI Cover Model, Young Female Model, Romance, Long Brown Hair, Lips, Black and White, Tattoos, Book Cover Model, Premade Book Cover
canva book cover, ai cover model, book cover model, romance cover, female romance cover, female cover model, sexy, tattoo, stock image, stock art, black and white, girl, woman",368,2,0,0,$15.00,$0,0
"StinnettMedia:African Leopard TV Art - AI-Generated Art - Exotic Wildlife Home Décor - Digital Download - Unique Living Room Centerpiece
African Leopard, TV Screensaver, AI-generated Art, Home Decor, Digital Download, Living Room, Wildlife Art, Exotic, Unique, Smart TV, Home Entertainment, wildlife screensaver, TV Art",735,0,0,0,$2.99,$0,2
"DreamyNekoStudio:Custom Ghibli Anime Couple Portrait – AI Generated Digital Drawing from Photo – Personalized Pet & Background Included Gift Art
ghibli portrait, studio ghibli print, fast anime delivery, custom anime picture, anime couple drawing, ghibli style artwork, anime fan art gift, animation ghibli, ghibli  style, ghibli poster art, photo anime style, ghibli art, commission ai art",1,0,0,0,$10.00,$0,0
"MSHIHEART:AI-Driven E-commerce Store: Personalization in Shopping Experiences
profitable buisness, business ideas, business growth, online business, ecommerce, ai ecommerce, personalized shoppin, AI product, increase sales, AI for entrepreneurs, AI-driven store, e-commerce tips, ai marketing",1,0,0,0,$17.25,$0,0
"NilunaDigitalDesign:150+ AI-Generated Animal Portraits | Unique Digital Animal Art | Printable AI Wildlife Wall Art | Instant Download
AI animal art, digital animals, wildlife printable, instant download, animal wall art, AI generated art, animal clipart, printable pet art, fantasy animal print, colorful animal art, animal illustration, nature print, digital wildlife",1,0,0,0,$2.83,$0,0
"USPrintLab:Digital Sunlight Art Print - Instant Download, AI-Generated Radiant Sunshine, Home Decor Wall Art, Home Wall Decor, Printable Wall Art
Personalized Gifts, Printable Wall Art, Gifts, Landscape Wall Art, Framed Wall Art, Canvas Wall Art, Vintage Print, Printable Art, Wildness Wall Art, Home Decor, AI Generated Print, Digital Download, Abstract Wall Decor",454,0,0,0,$4.99,$0,0
"AI Powered Chatbot, Millionaire Blueprint,Guide to Building a Million-Dollar AI Chatbot Business,no experience & investment required 60 days
AI chatbot business, Millionaire guide, business plan, Passive income, No code business, Entrepreneur eBook, Start chatbot agency, Digital business, AI services, earn home, no investment, no experience, busniness idea",1,0,0,0,$29.99,$0,0
"PromptFreeGPTs:Clarity Listener Toolkit – Voice Directed AI GPT | Organize Thoughts & Tasks | No Prompts Needed
voice planning tool, prompt free ai gpt, gpt task organizer, brain dump helper, custom planning gpt, gpt digital planner, no prompt gpt, adhd gpt planner, voice direct ai gpt, stress relief gpt, task and list gpt, executive function, mental load support",1,0,0,0,$7.50,$0,0
"The Age of AI Agents |  Learn AI Without Tech Skills | 20+ Page Beginner-Friendly Guide
AI automation, AI guide, ChatGPT course, AI for beginners, AI productivity, digital download, AI prompt pack, Automation tools, Learn AI, AI for enterpreneurs, Tech for non-techies, AI playbook, Zapier and AI",1,0,0,0,$26.52,$0,0
"AIPromptPacks:30 ChatGPT Digital Product Creation Prompts | AI Product Builder Toolkit | Create and Launch Profitable Downloads, Courses & Templates
digital product prompts, chatgpt product ideas, etsy seller tools, ai digital product builder, course creation prompts, lead magnet planner, notion seller tools, product bundle ideas, create passive income, etsy prompt pack, digital offer structure, monetise your skills, launch strategy guide",1,0,0,0,$13.25,$0,0
"AI Art For Luck
luck, lucky, aiart, ai, nature",1,0,0,0,$2.99,$0,0
"USPrintLab:Book Collections Ai Generated Wall Decor , Printable Wall Art, Gifts, Digital Download Prints, Vintage Print, Home Decor, Printable Art
Personalized Gifts, Printable Wall Art, Gifts, Landscape Wall Art, Framed Wall Art, Canvas Wall Art, Vintage Print, Printable Art, Wildness Wall Art, Home Decor, Digital Download, Abstract Wall Decor, Ai generated prints",455,0,0,0,$4.99,$0,0
"AIPromptPacks:50 ChatGPT Lead Magnet Prompts | AI Email List Builder Toolkit | Create Freebies That Convert for Coaches, Creators & Online Sellers
lead magnet prompts, chatgpt email list builder, ai freebies generator, opt-in prompt pack, email growth toolkit, digital download lead magnet, email list building pdf, chatgpt lead gen prompts, content creation for freebies, checklist lead magnet, digital product growth, creator prompt pack, subscriber growth prompts",1,0,0,0,$13.25,$0,0
"CognitiCanvas:Stunning Monochrome Art - AI Generated Mountain Artwork
ai, AI Generated Art, art, artwork, canvas, digital, Digital Artwork, generated, Home Decor, Monochrome Art, Mountain Art, wall",122,1,0,0,$10.00,$0,0
"LePoppetPrintables:MAGICAL MUSHROOM MANOR - 50 ai Grayscale Coloring Pages
grayscale coloring, adult coloring, coloring download, printable pdf, digital download, color page, ai generation, coloring book, shaded coloring, pdf coloring book, coloring book bundle, fantasy, mushroom",512,21,0,0,$6.00,$0,6
"1,000+ AI-Powered Digital Product Ideas – eBook with Prompts, Niches and Monetisation Tips for Etsy, Gumroad & Digital Creators
ai prompts ebook, digitalproduct ideas, side hustle planner, product vault, digital entrepreneur, niche planner, digital products, start a business, digital planner, chatgpt ideas",1,0,0,0,$2.64,$0,0