Shop / Listing,Listing Age (Days),Total Views,Daily Views,Est. Sales,Price,Est. Revenue,Hearts
"MadebyLuisAI:150+ Beauty Girls in AI Images - Volume 12, Digital Babes Clipart, Digital Art, PNG HD Resolution
digital art, ai images, ai generated, stock images, ai generated art, ai art digital download, digital image, image, ai designs, ai generated artwork, arte digital, digital download, digital product",139,12332,88.7,250,$9.46,"$2,364",46
"DigitalProductMRR:100K ChatGPT Prompts PLR | AI Prompts for Business, Marketing & Social Media | Make Money Online Ideas | Productivity and Automation Tools
Chatgpt prompts PLR, Prompt chatgpt plus, AI prompts bundle, Bussiness AI prompts, Marketing AI prompts, Social Media Prompts, Make money online, Onlines Business, Digital product PLR, Master Resell Rights, MRR PLR Bundle, top digital products, automation AI",38,2133,56.1,70,$6.82,$478,81
"UWAxNET:Digital Art by AI - (Update - No PDF) Asian Female with unique outfit and purple hair. Full Body. Art by: Cosmic
Asian, Ai, Ai Art, Digital Art, Ruin, Forest, Fishnet, Beautiful, Gem, Purple, Sheer, Ornate, Nude",737,22624,30.7,11,$15.00,$165,31
"VirtuallVault:100K ChatGPT Prompts |AI Prompts for Marketing, Business, Facebook, TikTok | Online Money-Making Ideas | Tools for Productivity Automation
E-commerce Solutions, Make Money Online, Automation Tools, Productivity Tools, Content Creation, Digital Marketing, Social Media Market, Affiliate Marketing, Business Automation, PLR MRR Content, ChatGPT Prompts, Marketing Strategies, AI Prompts",26,585,22.5,19,$7.03,$134,27
"ElvoraDesign:Create your AI Influencer Guide, playbook Monetize with AI + Digital E-Book + plr mrr, Social Media Marketing midjourney, Learn AI
ai influencer, influencer, ai, aiart, Social Media Ai, Influencer Guide, Virtual Influencer, Ai Influencer Ebook, Custom AI Model, AI Content Creator, AI Avatar, Chatgpt Plr, mrr plr",13,286,22,14,$3.30,$46,17
"PLRTrends:PLR Bundle AI, Plr Ebook, Plr Video Course, Resell Rights, Resale Rights, Plr Digital Product, Master Resell Rights, MRR,Digital Download
PLR Video Course, Private label rights, Master Reseller, MRR, Resell rights, Digital download, Digital products, Resale rights, PLR digital planner, PLR Bundle, PLR Ebooks, Chat GPT, AI Art",540,10874,20.1,561,$4.26,"$2,392",428
"WhimsyWebshop:3200+ AI Tools Database | Ultimate Cheat Sheet for AI Tools | Save Time and Scale Your Business | Latest AI Software and Automation Tools
ai tools, AI for Business, AI Automation, ai technology, business automation, AI template, AI Cheat Codes, ai for marketing, ai solutions, digital ai software, machine learning, productivity tools, Chatgpt tools",62,1048,16.9,54,$3.99,$215,55
"Promptalia:AI 750+ Tools Database | Easy to Use CheatSheet of AI Tools | Latest AI Products | Help to Scale Your Business | Save Time | Updated Monthly
ai tools, productivity tools, business tools, time-saving tools, ai tool guide, ai spreadsheet, ai cheatsheet, ai information, free ai tools, free ai resources, ai tools database, ai database, ai tools list",239,3742,15.7,123,$7.72,$950,143
"sillykangaroos:AI Exterior Color Renderings
AI, AI house design, AI architecture, AI Color Visualizer, AI color schemes, color schemes, home paint colors, home color palette, house renderings, home renderings, paint colors, paint color schemes, house colors",384,4803,12.5,62,$40.00,"$2,480",50
"HiLaser:Laser Cut Wooden Bird House Svg Dxf Ai, Wooden Bird Nest Laser Cut File, 3mm 3.5mm 4mm 1/8inch Wooden Bird Shelter Laser Cut File
Laser Cut File, Laser Cut Bird House, Wooden Bird Nest Dxf, Glowforge Cut File, Bird Nest Dxf, Laser Cut Bird Box, Bird House Cut File, Wooden Bird Nest Svg, Wooden Bird House Ai, 4mm Bird House Svg, 3mm Bird House Dxf, Bird House Template, Laser Project",376,4663,12.4,240,$4.75,"$1,140",334
"DigitalRoadToFreedom:The Ultimate AI Business Starter Bundle with 10 products  about ChatGPT & AI Toolkit for Digital Entrepreneurs | With MRR and Plr Rights
digital marketing, master resell rights, private label rights, digital product, plr digital products, done for you bundle, mrr and plr rights, plr mrr bundle, chat gpt prompts, chatgpt prompts, make money online, ai business toolkit, digital products",4,44,11,0,$36.39,$0,7
"ArtsCraftsLearning:PLR 300 Cat Realm AI Viral Videos with Full MRR | Customizable Cat-Themed Viral Video Content | Use, Resell, Monetize, & Boost Engagement
Viral Cat Videos, AI Cat Videos PLR, Cat Video Bundle, Fantasy Cat Videos, Cat Lovers Videos, Custom Cat Videos, Cat Video Content, PLR Cat Videos, Cat Viral Clips, Cat Video Pack, Resell Cat Videos, AI Cat Clips, PLR Viral Videos",227,2415,10.6,54,$18.24,$985,109
"crocrubies:AI: The Somnium Files Lanyard Charms
aitsf, ai the somnium files, aini, nirvana intiative, uchikoshi, zero escape, video game, visual novel, aitsf charms, acrylic charms, lanyard charms",413,3568,8.6,89,$12.00,"$1,068",195
"GRFXDecals:19 US Military Branches Vectors Vectors ai, cdr, eps, pdf, svg and also jpg, png - Instant Download -- 143 Files TOTAL (25 Folders)
US, MIlitary, Branches, USA, War, Vector, AI, CDR, EPS, PDF, SVG, JPG, PNG",667,5087,7.6,262,$1.88,$493,177
"SynthographyStudios:Prose in Motion, Digital Prints, AI Art, Download Black Woman Portrait, Wall Art, Modern Wall Decor, Breast Cancer, GPT4
black woman, black woman art, black woman png, black woman wall art, black women art, black women wall art, digital prints, ai art, ai images, ai art print, ai digital download, digital download, gpt4",482,2866,5.9,94,$5.00,$470,322
"DigitalBoutiqueNZ:Beacons AI Guide: Step-by-Step eBook for Beginners | MRR PLR | Digital Store Setup | Monetisation Tips | Digital Marketing | Passive Income.
Master Resell Rights, Digital Marketing, Faceless Marketing, Mrr Beacons Ai, Passive Income, Plr Beacons Ai, Beacons Ai Ebook, Beacons Plr Guide, Rich Girl Era, Downloadable Guide, Faceless Digital, Plr Digital Products, Stan Store Plr",12,60,5,1,$9.20,$9,5
"Skilliva:1000 AI Prompts Bundle | ChatGPT, Midjourney, Gemini, Canva, Claude | Digital Productivity Pack PDF
ai prompts bundle, chatgpt prompt pack, midjourney prompts, 1000 ai prompts, digital download pdf, prompt bundle set, productivity prompts, content creator tool, student prompts, etsy digital product, canva prompts pack, gemini ai prompts, niche prompt bundle",12,56,4.7,2,$1.75,$4,4
"TumblerWrapImages:AI Proof Watermark Protect Your Work with this AI-Proof Watermark The Ultimate Defense Against Image Theft.  Instant Download File
AI, ai proof, watermark remover, anti theft, anti image theft, copyright image, protect copyright, copyright, photographer, wedding photography, image editing, image editor, photo editor",33,144,4.4,7,$2.65,$19,6
"BrandAIAgency:High-Quality AI Generated Stock Models for Your Brand | Realistic AI Models | Digital Download
stock model, stock image, ai model, hair model, beauty model, lash model, stock photo, stock images, ai, ai influencer, models, makeup model, sock models",235,999,4.3,33,$5.55,$183,41
"Cosplayprintables:Mizuki AI Somnium Files Cosplay Sewing Pattern, Nirvana Initiative Mizuki Cosplay Sewing Pattern, AI Cosplay Pattern, Mizuki Cosplay Pattern
AI somnium files, nirvana initiative, mizuki, mizuki cosplay, mizuki costume, Mizuki pattern, sewing pattern, AI Mizuki, Cosplay pattern, indigo patterns, NI Mizuki, somnium files, plus size pattern",838,3164,3.8,79,$14.69,"$1,161",135
"ModernBusinessTools:Use AI to do Anything - Easy Guide to using AI to do Anything for any Reason - Guide to Generate Advance, Lengthy Prompts & Best Responses
AI beginner guide, AI usage guide, AI prompts guide, AI business prompts, AI prompt tips, Chatgpt prompt tips, AI business guide, AI productivity tips, Chatgpt advance tips, chatgpt expert guide, step by step prompts, any content with AI, AI learning guide",144,532,3.7,13,$14.99,$195,41
"LiviLuCreative:Flower Watch Band Design SVG & AI Bundle, Silicone Band, Laser Engrave, Floral Watch Band for Glowforge
glowforge, laser engrave, custom band, AI file, SVG file, digital download, design, flower design, floral",1673,6063,3.6,312,$3.99,"$1,245",413
"GRFXDecals:22 Toyota Gazoo Racing Vectors ai, cdr, eps, pdf, svg and also jpg, png - Instant Download -- 159 Files TOTAL (9 Folders)
Toyota, Gazoo, Racing, Sport, GR, Vector, AI, CDR, EPS, PDF, SVG, JPG, PNG",623,2166,3.5,111,$1.91,$212,45
"PartyBrew:Prompt Engineer Shirt. Funny AI Shirt. Definition Shirt. Machine Learning Shirt. Artificial Intelligence Gift. Chatbot AI shirt
AI Scientist Shirt, Artificial, Intelligence Gift, Software Engineer, Machine Learning Pun, funny ai shirt, Prompt Engineer Gift, ai tee, ai tshirt, Chatbot AI shirt, Definition Shirt, prompt engineering, text prompt tshirt",723,2372,3.3,53,$19.95,"$1,057",43
"CozyNestWorks:Botanical Elegances In Line Art, Midjourney prompts, AI prompts, AI Arts
AI Prompts, Hot Prompt, Midjourney Prompts, Dall-e prompt, Digital Art, Botanical, Elegances, In Line, Elegances In Line, digital print, wall decoration, digital photo, Paintings",134,323,2.4,16,$1.90,$30,4
"AncestryAimee:Use A.I. to Build your Family Tree - Identify Ancestors, and Sources
family search, familysearch, ai, ai in genealogy, build family tree, genealogy, ancestry, ancestry aimee, family history, using ai, ai in family history, find ancestors",17,40,2.4,2,$4.99,$10,2
"CharacterImagines:Personalized Character AI Scripts
Character AI, Character AI scripts, Personalized Chatbot, Personalized CAI, Draco Malfoy, Harry Potter, Marvel, Comfort Character, Fanfiction, Personal AI Chatbot, CAI scripts, CAI Chatbot",304,686,2.3,22,$6.25,$138,13
"3DReefInnovations:AI prime 16hd light shade
Reef, Aquarium, Aquarium light, Coral, Fish tank, Ai prime, Light Shade",332,725,2.2,18,$11.99,$216,4
"WallArtDecorbyRK:Buffalo in a Winter Wonderland: AI Midjourney Generative Wall Art - Wild Buffalo in a Serene Winter Landscape - Western American Landscape
American bison photo, bison art, buffalo art, wild bison, buffalo wall art, Midjourney AI, buffalo ai artwork, buffalo, rustic wall art, buffalo ai art, midjourney ai art, buffalo décor, ai art buffalo",651,1371,2.1,36,$7.95,$286,20
"SticksAndStonesWS:Nurse American Flag Design, SVG DXF AI , Digital File Only
SVG, AI, DXF, Design, CNC, Router, Laser, Digital, Indoor Sign, Outdoor Sign, RN, Nurse, Stethoscope",986,2011,2,103,$2.15,$221,167
"TreasuresofBaila:Cute Cat Riding Bicycle Digital Download | AI-Generated Cat Art | Whimsical Cat  wallpaper for Smartphone, Desktop, Tablets (9x16 & 16x9)
cat, bike, ai, art, digital, digital art, wallpaper, design, bicycle, phone, desktop, cute, fun",1,2,2,0,$5.25,$0,3
"NanaByZulfia:4600+ AI Writing Prompts for Creatives, Entrepreneurs & Content Creators | Massive Digital Prompt Bundle
Ai prompt, Midjourney promp, prompt bundel, Marketing prompts, ChatGBT prompts, Social media prompts, Ai tools for creatir, Copywriting prompts",4,8,2,0,$2.79,$0,2
"PlrProfitStudio:Claude AI Video Course, Content, Automation, Commercial Use, Passive Income, Educational, Faceless Digital Marketing, Resell Rights, MRR PLR
Claude AI Course, AI Content, PLR Video Course, PLR, AI Training, Claude AI Training, AI Sales, AI for Content, video course, MRR, resell rights, passive income, ai plr",81,141,1.7,3,$17.06,$51,11
"crocrubies:AI The Somnium Files Foil Stickers
aitsf, ai the somnium files, somnium, aini, uchikoshi, zero escape, video game, kaname date, nirvana initiative, visual novel, aiba",145,229,1.6,7,$5.00,$35,32
"MaleArtGalleryStudio:Muscular Chiaroscuro Study | AI Art Poster of Shirtless Male | Fitness Wall Decor | Bodybuilding Artwork | Home Gym Aesthetic
gay wall art, mens art prints, homoerotic prints, male figure art, gay art print, gay male art, masculine wall art, pride wall art, homoerotic, gay ai art, handsome man, gay artwork",89,137,1.5,3,$12.64,$38,6
"SparkWaken:300+ Ways To Make Money Online With AI Image Generation from Midjourney | Passive Income Digital Product Ideas PLR MRR eBook
how to make money, AI art, online business idea, plr digital product, lead magnet, small business, passive income, digital product idea, midjourney guide, make money online, mrr plr, make money AI art, ai image generation",4,6,1.5,0,$9.00,$0,0
"AllThingsMRR:Leaves Photos Minimalist AI Stock Images Featuring Leaves Photography for Social Media Backgrounds Done For You Digital Products Resell
ai images, images with mrr, stock images, stock photos, instagram images, faceless branding, aesthetic images, canva templates, instagram posts, master resell rights, mrr stock images, stock image bundle, green leaves stock",162,196,1.2,10,$4.50,$45,19
"DigiDap:AI Photography Custom Photography Boudoir Photography Custom Portrait Personalized Portrait Personalized Photography
photography, ai, ai photography, boudoir, painting ai, abstract ai, xxx photography, boudoir photography, custom portrait, personalized, ai a, gifts for him, valentines",622,700,1.1,6,$69.00,$414,9
"YarnwawaPatterns:Hoshino Ai from Hoshino Ko / PDF Pattern, Crochet, Amigurumi
crochet, amigurumi, crochet pattern, amigurumi pattern, anime crochet, anime, pattern, anime amigurumi, hoshino ai, crochet hoshino ai, hoshino ko, anime pattern, crochet doll",467,504,1.1,16,$6.50,$104,51
"premiumdxf:Silverstone Circuit, Dwg-Svg-Dxf-Ai-Pdf, Downloadable Art,Downloadable Dwg Map, Dxf Files for Plaasma, Dxf files for Laser
dxf, ai, laser cut, downloadable dxf, pdf file, dxf file, svg, race map, dwg file, digital race map, vector art, plasma file, Silverstone Circuit",397,450,1.1,14,$5.00,$70,30
"lilemandthings:AI Free Creative Tool Holographic Sticker | Artist Sticker | Water Bottle Stickers | Laptop Decal | Funny Artist Decal | Pencil Artist
holograph sticker, laptop sticker, holographic, trendy sticker, water bottle sticker, laptop decal, laptop decals, water bottle, funny Artist gift, pencil, funny AI free, creative tool, cute art",54,54,1,2,$3.75,$8,18
"Ai pictures, ai creation, ai videos ,ai world , AI content creation
ai picture, ai video, ai poster, ai world, ai content creation, content creation, creator, ai creator",245,245,1,0,$45.49,$0,6
"cutecutfiles:Apple with Heart SVG PNG AI | Apple Clipart | Apple Cut File | Apple with Heart Clip Art | Teacher Apple svg
apple svg, apple png, apple heart svg, apple heart png, apple clipart, apple cut file, apple clip art, teacher apple svg, teacher apple png, apple heart cut file, apple heart clipart, apple ai, apple cutting file",1180,1021,0.9,52,$1.25,$65,141
"CreativecrateShop:A.I. Agents | Instant Access | Empower Your Creativity
AIBots, Digital AI bots, Creative automation, Digital innovation, Digital automation, Oracle Agents, tech tools, high level prompts, prompt engineering, AI, ai agents",78,71,0.9,3,$2.99,$9,2
"MarkedwithPrecision:Semper Fi AI8 and Grayscale DIGITAL DOWNLOAD. 3D Slice, Height Map
Semper Fi, LightBurn, 3D Slice, Coin, Fiber Laser, USA, Proud, Independence Day, AI8, GrayScale, Depth Map, Height Map, Engraving",708,589,0.8,19,$8.99,$171,21
"BastiandDADdesigns:St. Michael Protect Us SVG, PNG, ai and jpeg, Police Protector, Blue Line Angle
USA Flag SVG, AI SVG PNG JPEG, CNC and Laser Files, Cut files, Police Angle, St Michael Protector, Protect Us, Thin blue line, K9 dog angle, Law enforcement svg, Police badge, Sheriff star, First responder",707,560,0.8,28,$4.49,$126,38
"DaisyDreamscapes:Aesthetic Midjourney Prompt Bundle for Stock Photos AI Images Prompts Stock Photo Midjourney Prompts Regency Era MRR PLR Bundle Stock Photos
midjourney prompts, stock images, stock photos, aesthetic ai prompts, stock images prompt, ai photos prompt, midjourney photos, midjourney images, ai midjourney prompt, ai images prompt, prompt bundle, stock photo prompts, mrr plr bundle",286,233,0.8,12,$4.36,$52,19
"HerDesignVault:Boss Babes Stock Photos Women in Charge AI Stock Images Master Resell Rights Women Empowerment Stock Images Female Business Owner Graphics
luxury instagram, master resell rights, faceless digital, melanin product, stock photos, ai stock images, ai stock photos, canva template PLR, social media PLR, woman stock photos, Black and Cream, Business woman stock, boss babes images",120,73,0.6,2,$5.00,$10,11
"TheCutLibrary:Cactus DXF, AI, EPS, Svg, Png Files | Wall Art | Cut File for cnc, Plasma, Laser, Glowforge, Cricut
cactus wall art, SVG cut files, digital wall art, nature wall decor, art for cutting, DXF cut files, AI cactus design, EPS wall decor, laser cut cactus, PNG cactus image, CNC cactus cutout, cactus cut files, SVG cactus art",19,11,0.6,0,$5.46,$0,3
"RomanceCoverModels:AI Male Model: Romance Novel Cover Model, AI Photography, Handsome Man Portrait, Photos for FB Ads
AI Model, AI Cover Model, Romance Novel Model, Male Model, Cover Model, Male Cover Model, AI Photography, Handsome Man, Male Portrait, Digital Art, AI Art, Novel Cover Art",694,360,0.5,4,$35.00,$140,8
"WillowDomanic:leaves wall art svg,dxf, EPS,AI and PDF files.plasma cut file,wall art dxf,laser cut files,Glowforge files, woman panel svg
laser cut, digital files, ai, svg, pdf, dxf, wall art, plasma cut, eps, vinyl cut, download, leaves, leaf",792,418,0.5,21,$2.85,$60,61
"LiviLuCreative:Strength Watch Band Design SVG & AI Bundle, Silicone Band, Laser Engrave, Hope Motivational Watch Band for Glowforge
silicone band, digital design, svg file, ai file, laser engrave, glowforge, strength, hope, encouragement",1651,714,0.4,36,$3.99,$144,27
"LaserTemplateStore:Wooden box. Laser cut file. Cdr, Dxf, Ai, Svg. Instant download, Cnc files. BX17
plywood box, ai box, vector box, cdr box, svg box, digital box, jewelry box, laser cut file, laser template, eps box, laser, ecp, glowforge fiel",1832,783,0.4,40,$2.99,$120,59
"BastiandDADdesigns:US Army Master Gunner logo SVG, PNG, ai and jpeg, Special Forces, Fort Benning, Identification Badge, Military logo
USA Flag SVG, AI SVG PNG JPEG, CNC and Laser Files, Cut files, Military SVG PNG, US Army SVG, US Military svg png, Identification Badge, Master Gunner, Army Gunner, Gunnery Sgt, Special Forces, Fort Benning",678,272,0.4,14,$4.49,$63,4
"Sofetchdigitalart:70 Tropical Spray Tan Stock Images | AI Beauty Stock Photos for Spray Tan Business | Digital Marketing Images | AI-Generated Models |
ai model images, spray tan photos, tropical stock image, stock photos, beauty stock photos, tanning stock image, stock model image, beauty stock images, tropical spray tan, tropical beauty, ai generated photos, beauty stock image, tanning stock photos",75,27,0.4,0,$8.25,$0,1
"HappyCamperUniques:1962 Corvette digital files eps, svg, ai, dxf, jpg
corvette, car, cnc, dxf, svg, eps, ai, cricket, glowforge, cut file, drawing, gift, musclecar",523,156,0.3,8,$3.00,$24,4
"BetterSelfDigitals:1 AI generated black woman, Hair model, Hair extensions bundle, Baddie model, Raw hair, Instant download, African American, Glam makeup
AI stock photo, AI generated photo, AI generated woman, Hair model, Brand model, Hair extension stock, Stock photos, Branding kit, Darkskin photo, Hair model stock, Baddie photo, Black woman clip art, African american",435,109,0.3,3,$5.78,$17,4
"OCGS:ChatGPT & GEMINI AI Prompts Masterclass: 45,000+ Prompts for All Levels -  AI for Content, Marketing, Business - Prompt Engineering
Google, chatgpt, gemini, google gemini, gemini ai, gemini prompts, chatgpt prompt, nlp, content creation, prompt engineering, machine learning, ml, gemini tutorial",294,78,0.3,1,$12.37,$12,9
"BrainBoostCreations:AI Made Simple: A Beginner’s Guide to Understanding and Using Artificial Intelligence
AI made simple, Intelligence, success, future AI, simple guide to AI, chatgpt, beginners, guide, learn ai, technology",12,4,0.3,0,$11.36,$0,0
"2Dx3D:Vector PING-PONG, table tennis, SVG, ai, eps, png, pdf, jpg Download, Digital image, graphical image, printable, discount coupons
svg table tennis, whiff-whaff game, ping-pong drawing, Single doubles sport, indoor Racquet sport, ai eps dxf png pdf, tennis rackets art, net divided table, Olympic sport, vector image, cricut racket file, men's doubles sport, love tennis game",1821,305,0.2,15,$3.25,$49,5
"craftedmade:Shark Coochie Board SVG AI
shark coochie, laser, cricut, silhouette, SVG, AI, shark, xxx, xrated, naughty, file",1688,297,0.2,15,$3.00,$45,11
"CNCCreativityDesigns:Weihnachtsglocke ""Fröhliche Weihnachten"" DXF, SVG, AI, zum Lasern, Fräsen, Plasma- oder Wasserstrahlschneiden, Baumschmuck, Türschmuck
Laser, schneiden, Weihnachten, Ornament, Advent, Türschmuck, DIY, Haustür, selbst, Weihnachts kugel, Baumschmuck, DXF SVG AI lbrn2, X Tool",505,111,0.2,5,$2.84,$14,4
"DnDRetroArt:Ai 3D Retro Video Game Dark Fantasy art
N64, Dark Fantasy, Retro Video Game, Ai art",122,27,0.2,1,$4.85,$5,0
"KPginariumDesigns:kittl AI generated lion head
lion head, kittl AI, digital, multi coloured",653,108,0.2,1,$2.27,$2,0
"PaisleyStudiosDesign:PS035 - Christmas Vectors for Plates; ai, eps, svg, gsd; ( png files, dxf files, and jpeg files also available )
vinyl, patterns, vectors, AI, SVG, EPS, GSD, Silhouette files, Cricut files, Holiday, Christmas, Santa plate, DXF",3571,408,0.1,13,$9.00,$117,79
"PaisleyStudiosDesign:Tennessee Home Sweet Home Vector; ai, eps, svg, gsd, dxf, png; ( jpeg files also available )
vinyl, patterns, vectors, AI, SVG, EPS, GSD, Silhouette files, Cricut files, DXF, state pride, home sweet home, Tennessee",3447,278,0.1,14,$3.50,$49,72
"KaciBellaDesigns:Printable VIRTUAL REALITY or AI Games Surprise Gift Reveal Ticket. Admission Pass. Printable Ticket. Event Stub. PdF Instant Download
Surprise Gift, Trip Gift, Trip Ticket, Boarding Pass Gift, surprise vacation, vacation ticket, surprise holiday, graduation gift, birthday gift, admission ticket, gift reveal, AI Games, Virtual Reality",1580,118,0.1,6,$3.00,$18,1
"MJMcreation808:Faith Hope Love SVG, Dxf, Ai, Lightburn Digital File, Cut Files for Glowforge, Silhouette, Cricut, Lightburn, LM2
faith hope love, faith, hope, love, svg, dxf, ai, lightburn, laser cut, laser engrave, ORTUR MASTER 2, GLOWFORGE",1540,187,0.1,9,$1.99,$18,12
"BGIDesigns:Elk Bull 4 vector eps / ai / svg / pdf / dxf / png / jpeg Bull Elk
eps, ai, digital download, png, Elk, Bull, Wapiti, Bull Elk, Hunting, Hunting Elk, The Strut, Strut Elk, Roosevelt Elk",1202,66,0.1,3,$4.00,$12,16
"canvaholic:Madden - AI cover model, AI male model, billionare, AI male, Male cover model, Cover model, Book cover, Book cover model, Premade cover book
ai model, ai art, cover model, man portrait, man cover, digital, handsome man, man model, midjourney, ai cover art, ai cover, book, book cover",616,54,0.1,0,$30.00,$0,0
"TimelessLovePrints:Italian Landscape Napoli Cove Art, AI-Generated Printable Art, Vesuvius Volcano Art, Sorrento Print, Macbook, Desktop or Laptop Background
Digital Download art, Ai Generated art, Printable art, Coastal Wall Art, Italian Landscape, Cove art, Napoli print, Laptop Background, Desktop background, Macbook background, Sorrento Print, Volcano Art, Vesuvius",247,14,0.1,0,$5.00,$0,0
"DnDRetroArt:Ai Retro Video Game Art
NES, Dark Fantasy, Retro Video Game, Ai art",122,9,0.1,0,$4.85,$0,0
"DuglyGraphics:Vector HORSE, AI, eps, pdf, svg, dxf, png, jpg Download, Digital image, graphical, discount coupons
printable silhouette, vector ai animation, animal horse drawing, ai stylized animalia, fun silhouet animals, knight steed equine, bronco prints file, download ai vector, art designs graphic, computer decor arts, wall home decoration, interior png design, cute digital picture",3699,149,0,7,$2.67,$19,47
"DuglyGraphics:Vector DREAMCATCHER, Download, Digital image, graphical, AI, PNG, eps, svg, pdf, dxf, jpg, dream, discount coupons
luck Dreamcatcher, feather dreams png, daydream phantasy, cloud-castle fantasy, daydream print, download ai vector, art designs graphic, computer decor arts, wall home decoration, interior png design, cute digital picture, animal circles  jpg, abstract illustratia",3242,123,0,6,$2.67,$16,30
"DuglyGraphics:Vector CARTOON character, AI, eps, pdf, PNG, svg, dxf, jpg Download, Digital image, graphical image, discount coupons
FORM with holes, CARTOON character, shape mode draws, manner model library, Download ai vector, art graphic design, abstract animal, funny surprise, digital fright arts, cute kids art, fantasy prints, wonderment, eye-opener",3419,118,0,6,$2.67,$16,25
"ThePortraitArt:AI Computer Chip, Technology Imagery, 20 oz Skinny Tumbler Wrap, Tumbler Image, Straight and Tapered Wrap, Tumbler Sublimation Design
AI Chip, Tech Imagery, 20oz Skinny Tumbler, Nurse Tumbler Wrap, Tumbler Sublimation, Sublimation Design, Tumbler Wrap, Tech Lover, Instant Download, Innovative Design, Straight Wrap, Tapered Wrap, Science Design",679,0,0,0,$3.99,$0,2
"AuroraNovaCo:Create & Sell eBooks with AI – Make Money Online eBook | Instant Digital Download Write Profit with AI – eBook Creation Selling Guide
AI Tools, Make Money with AI, ChatGPT Tutorial, MidJourney Guide, Digital Products, Etsy SEO Guide, AI Art Creation, Create and Sell, Passive Income, AI Digital Products, AI Business Course, Sell Digital, AI Art for Profit",1,0,0,0,$2.99,$0,0
"SevenstylesDesign:Using AI To Improve Your Product Photos | Elevate Your Visuals - PDF Guide (2025)
AI Photo Editing, Product Photography, Creator Guide, Etsy Seller Tips, Small Business Tools, AI Photography, Visual Marketing, Background Removal, Image Upscaling, AI Art Tools, Photography Guide, PDF Guide, Digital Download",1,0,0,0,$1.92,$0,0
"AI CV Builder for University Students | Graduate Job CV Template + ChatGPT Prompts
graduate cv, student cv, uk cv template, first job cv, AI prompts for cv, digital cv builder, cv writing, cv guide uk, etsy cv download, cv for no experience, graduate job prep, job application help, ChatGPT",1,0,0,0,$9.27,$0,0
