Shop / Listing,Listing Age (Days),Total Views,Daily Views,Est. Sales,Price,Est. Revenue,Hearts
"chickssellingdicks:10 pack Adorable Squishy Stress Toy - Squishy with Hat - Bachelorette Party Favor - Bachelor Party Favor - Mochi Toy - Party Favor
Squishy, Stress Toy, Ding Ding, Mochi, Bachelorette Party, Party Favor, Gag Gift, Bachelorette Favor, Bach Party Favor, Bachelor party favor, Last Disco Bach, Last Rodeo Bach, Final Fiesta Bach",567,87065,153.6,1976,$17.49,"$34,560",2692
"LavenderDreamsFL:Eucalyptus Shower Bundle, Lavender, Eucalyptus, Aromatherapy,  Stress & Sinus Relief, Self Care, Eucalyptus Lavender Bundles, Home Decor
Eucalyptus, Aromatherapy, Relaxation, At Home Spa, Hanging Eucalyptus, Self Care, Stress Relief, Sinus Relief, Eucalyptus Bundles, event decor, bathroom decor, Lavender, Eucalyptus Lavender",1628,50281,30.9,1141,$15.99,"$18,245",2275
"JoellaCraftsShop:Stress Blobs PATTERN/ Crochet Fidget Toy Pattern/ Crochet Stress Ball Fidgets/ No Sew Cute Crochet Plush Pattern
plushie pattern, crochet pattern, cute crochet plush, crochet plushies, crochet patterns, crochet plush, crochet fidget, crochet fidget toy, crochet stress ball, stress ball, stress blob, stress ball crochet, stress blob pattern",328,68660,209.3,3542,$2.85,"$10,095",4003
"PilchPrints3D:3D Printed Fidget Roller Stress Toy (Single and Dual Color options available)
Fidget, Fidget Roller, ADHD, autism, Stress Toy, Stim Toy, Fidget Toy, EDC Fidget, Desk Toy, 3D Printed, Sensory Toys Autism, Worry Toy",2479,31783,12.8,1052,$8.99,"$9,457",2510
"3Dcopticprints:Articulated Gemstone Dragon, Fidget Toy, Desk Stress Toy, Dragon Decoration 3D Printed, Cinderwing3D, Rainbow colors available!!
crystal dragon, fidget dragon, winged dragon, fidget toy, articulated, stim toy, candy corn dragon, mystery dragon egg, crystal gem dragon, 3d printed fidget, luck dragon, autism toy, flexible dragon",525,33435,63.7,1106,$8.50,"$9,401",488
"LavenderLuvies:Lavender Scented Stress Ball  ""Stress LESS""
Stress Relief, Aromatherapy, Desk Toy, Squishy, Lavender Scent, Anxiety Relief, Autism, Sensory Toy, Fidget Toy, Party Favor, adhd tools, meditation, relaxation",1763,32093,18.2,1062,$8.00,"$8,496",2321
"PrintVertical3D:Knurled Fidget Roller Stress Relief Item. Key Ring, Pain Stim Pendant, Tactile Stim Fob, EDC Haptic item, 3D Printed in USA
3D Printed, Fidget Toy, Stim Toy, unique gift, EDC, Fidget, Fidget Toys, fidgets, Gift, Fidget Spinner, stress relief, Gift for him, Gift for Her",1915,26928,14.1,891,$9.50,"$8,464",1828
"PrintFusionArtworks:Chicken Wing Toy Transformable Stress-Relief Desk Accessory | Fun and Quirky Gift for Adults and Kids Flexible Realistic Toy Gag Gamer Gift
stress toy for kids, fun office gadgets, fun desk gadgets, gift for friends, fun gadgets, stress relief gift, desk toy for adults, cool stress toys, fun pocket toy, interactive toy, chicken wing knife, retractable knife, stress relief toy",137,13085,95.5,210,$33.55,"$7,046",286
"JoellaCraftsShop:4 in 1 Pattern Bundle- Stress Blobs, Stress Pets, Bubble Butties, Chicken Laying an Egg / Crochet Fidget Toy/ Crochet Stress Ball Pattern
crochet pattern, crochet plushies, crochet patterns, crochet plush, crochet fidget, crochet fidget toy, crochet stress ball, stress ball, crochet frog, crochet pug, stress ball pattern, stress blob pattern, stress pet crochet",298,17085,57.3,565,$8.95,"$5,057",904
"TheSqueezeDough:The Squeeze - Lavender 100% essential oil stress relief therapy dough for self care, aromatherapy stress ball, stress relief
adult play dough, aromatherapy dough, essential oils, exercise putty, stress ball, lavender, adult slime putty, aromatherapy putty, office gift, stress dough, therapy dough, anxiety dough, fidget dough",2198,16487,7.5,413,$10.49,"$4,332",1037
"GoodJourneyCo:REUSABLE  picky pad kit,anxiety, stress relief, Fidget Toy, PickyPad, Dermatillomania, ADHD, Autism, Skin Picking, Hair Pulling, sensory
pick pad find it, autism fidget, picking toy, picking fidget, adhd fidget, skin picking pad, anxiety reducer, reusable picky pad, remeltable picky pad, DIY picky pad, adult fidget, grounding tool, picky pad and tray",158,13668,86.5,452,$9.50,"$4,294",548
"LemonTreeBadgeReels:Funny ""In da Clerb we all Stressed"" Scrubs Badge Reel - Retractable Badge Holder - Lanyard - Carabiner - Medical Humor - RN MD Gift
badge Reel, Retractable Reel, funny badge reel, nurse badge reel, er ed nurse tech, IN DA CLERB, FUNNY MEME, RN CNA TECH LPN PA, RT RRT XRAY TECH, we all stressed, medical humor, scrubs badge reel, nurse doctor tech",117,11427,97.7,378,$9.49,"$3,587",1579
"GoodJourneyCo:REUSABLE  Kitty Cat Picky Pad, anxiety, stress relief, Fidget Toy, PickyPad, Dermatillomania, ADHD, Autism, Skin Picking, Stim Toy, OCD
pick pad find it, dermatillomania, autism fidget, picky pad, picking toy, picking fidget, adhd fidget, skin picking pad, anxiety reducer, reusable picky pad, remeltable picky pad, sensory play, cat lover gift",157,6384,40.7,88,$35.50,"$3,124",369
"LucidLavenderCo:Organic Anxiety Oil | Natural Stress Roll On
natural oil, anxiety oil, stress oil, stress aromatherapy, anxiety aromatherapy, relax oil, relax aromatherapy, organic oil, organic roll on, anxiety perfume, anxiety remedy, stop anxiety, natural anxiety oil",1075,4560,4.2,85,$28.00,"$2,380",141
"ArcaneCrystalarium:Reusable Picky Pad Ghost Forest, Stress, ADHD, Dermatillomania, Anxiety, Non-Toxic, Biodegradable, Skin Safe - Satisfy Your Urge to Pick!
desk stress toy, remeltable picky pad, squishable gift, self care, autism, adhd, Dermatillomania, squishy, mental health, reusable, ghost forest, fidget melt, melting meltable",144,4210,29.2,67,$31.99,"$2,143",329
"BossBodyworks:Organic ENERGY & STRESS RELIEF Tincture, Adaptogenic Adrenal Support Tonic, adaptogen, adaptogens
astragalus, ashwagandha, rhodiola, panax ginseng, ginseng, adaptogena, adaptogenic, adaptogens, schisandra, licorice, tonic, energy, stress relief",4475,3604,0.8,49,$36.75,"$1,801",214
"CocoWyoColoring:Stress Relief: Simple and Relaxing Coloring Book by Coco Wyo
coco wyo, coloring book, inspirational, digital coloring, relaxing book, stress relief, adult coloring book, coloring pages, cute coloring book",328,22984,70.1,1185,$1.49,"$1,766",910
"PilchPrints3D:3D Printed EDC Fidget8 Stress Toy (Single and Dual Color options available)
Fidget, Fidget Roller, ADHD, autism, Stress Toy, Stim Toy, Fidget Toy, EDC Fidget, Desk Toy, 3D Printed, Sensory Toys Autism, Worry Toy, Figure 8",1345,4862,3.6,122,$10.99,"$1,341",317
"AnomalyVFX:Bubbling Caldron Stress Ball Fidget | Crochet Pattern
Fidget, Crochet Pattern, Amigurumi, Crocheted, Plush, Toy, Pattern, How too, Stress Ball, Caldron, Witch, Bubbling, Halloween",283,6770,23.9,349,$3.50,"$1,222",824
"ItsSisterStuff:Dammit Doll, Cincinnati Bengals, stress relief
dammit doll, sports doll, football doll, stress relief, sports fabric doll, football team doll, NFL dammit doll, Cincinnati dammit, Bengals dammit, Cincinnati Bengals, Bengals dammit doll, Cincinnati doll",674,2648,3.9,60,$17.95,"$1,077",115
"ArtisticRainbowSlime:Aromatherapy Dough Sample Slime, Stress Relief, Artistic Rainbow, Slime Shop
slime, stress relief, sensory, relaxing, gift for her, therapy, sensory toy, stress toy, slime shop, artistic rainbow, clear, cloud, aromatherapy",350,5171,14.8,171,$5.49,$939,177
"AstralProjectionsCo:Galaxy stress Ball - 2.5 Inch
Galaxy, Fidget Toy, Stress Ball, squishy, desk, school, soft, adhd, space, stars, bouncy, balls, blue",1199,4679,3.9,233,$3.99,$930,338
"WorldDigitalPlanet:Burnout Processing Journal, Stress Employment Burnout, Relationship Burnout, Emotional Burnout,  Anxiety, Mental Health 8,5x11"" Printable
Therapy Journal, Mental Health, Anxiety Journal, Journal Prompts, anxiety, Stress, Medical Journal, KDP interior, Emotion List, Burnout Processing, Burnout, stress relief, Burnout therapy",1022,3433,3.4,113,$6.63,$749,292
"FidgetPicksShop:CAT Silicone Picking Pad - Stress and Anxiety Relief - Fidget Pick Toy - Skin Picking, Dermatillomania, ADHD - Gift for Cat Lovers
Silicone Picky Pad, Fidget Pick Pad, Anxiety Relief Pad, Bead Picking Pad, Skin Picking Pad, Dermatillomania Pad, Fidget Toy, Silicone Picker Pad, Fidget Picker Toy, cat picky pad, cat themed gift, cat lover gift, kitty picky pad",151,1558,10.3,32,$22.99,$736,201
"CuriousCutes:No Sew Octo Stress Ball Octopus Crochet Pattern - Solid Color, Classic Rainbow, and Pastel Rainbow Directions  (PDF Digital Download)
crochet pattern, stress ball, stress ball pattern, easy crochet pattern, beginner crochet, no sew pattern, crochet octopus, octopus pattern, octopus, octopus stress ball, squishy, rainbow, stress blob pattern",290,3801,13.1,196,$3.75,$735,290
"ArcaneCrystalarium:Reusable Picky Pad Anime Movies Themed, Stress, Dermatillomania, ADHD, Anxiety, Non-Toxic, Biodegradable, Skin Safe, Satisfying!
fidget melt, desk stress toy, remeltable picky pad, squishable gift, Dermatillomania, melting meltable, mental health, reusable, charm bracelet slime, aromatherapy squishy, diy keychain bead, autism adhd beads, skin picking pick",71,1277,18,20,$31.99,$640,114
"TaraMarieJewelry:White Howlite ""Stress & Anxiety""  Sterling Silver or Gold Filled Healing Gem dainty necklace for sensitive skin.  Funny Gift for her
gemstone, funny, metaphysical, white, marble, Tara Marie Jewelry, holistic healing, everyday necklace, jewelry with meaning, stress relief, layering necklace, anxiety, xanax",926,1028,1.1,14,$39.00,$546,55
"PocketShellsCharms:Discover Ultimate Stress Relief with complete Yoga Stretch Class Sequence | Instant Download | YOGA | Ideal for both teachers and students |
stretch yoga class, digital yoga class, Yoga PDF download, yoga flow sequence, yoga class planner, stretch stress class, yoga routine, yoga stretch class, yoga for stress, stress relief, yoga pose, yoga class, Gift",699,5377,7.7,277,$1.80,$498,81
"ThickThumbCrochet:Stress Pet Pattern, Crochet Cat, Fidget, Mini Kitty Strees Ball, No Sew Cute Plushie, Small Sensory Toy, Stress Blob, Anxiety Relief Aid
plushie pattern, stress toy, quick market make, crochet fidget toy, stress blob, sensory toy, pocket pet, amigurumi toy, crochet animals, anxiety relief, mini kitty, cute crochet cat, fun crochet pattern",291,2310,7.9,119,$3.55,$422,185
"ThePickFix:Easy Picking Picky Pad - Reduce Anxiety, stress, and skin picking
Picking Fidget, Skin Picking, Compulsive picking, fidget toy, Anxiety Relief, picky pad, Dermatillomania help, bfrb, mental health, coping strategy, stimming, stress relief, anxiety toy",280,1144,4.1,28,$12.99,$364,80
"ColorfulTherapyTools:Anxiety Relief Workbook for Teens Stress Relief Tools Emotion Regulation Skills How to manage feelings Therapy Tools for Adolescents
anxiety relief, stress reducing, adolescent workbook, teen worksheets, emotion regulation, therapy tools, CBT tools, DBT tools, teen stress, teen therapy, adolescent therapy, therapy worksheets, anxeity",710,850,1.2,17,$20.00,$340,47
"CoolBeanLiving:Burnout Recovery Workbook | Printable Stress Management Worksheets for Reducing Mental and Physical Fatigue
burnout recovery, burnout prevention, burnout processing, mental wellness, stress reduction, burnout workbook, stress management, mental fatigue, stress relief, recovery self-care, self-care for stress, stress recovery, therapist workbook",657,1344,2,69,$4.88,$337,129
"IntuitiveSoulsShop:Miniature Zen Garden Decor Kit, Stress Relief Gift, Sand Garden
Zen garden, spiritual gift, feng shui, spiritual decor, Crescent moon, Zen decor, aesthetic decor, meditation zen decor, meditation zen gift, mini zen garden, miniature zen garden, stress relief gift, gift for creativity",479,707,1.5,16,$19.97,$320,49
"ColorfulTherapyTools:Emotional Regulation Guide teens adults emotion regulation stress relief for adolescents for parents teachers counseling
emotion regulation, emotional regulation, teen mental health, adolescent therapy, teen workbook, mental health, teen anxiety, teen stress, teen skills, relaxation tools, body awareness, somatic therapy, relaxation skills",703,1064,1.5,26,$12.10,$315,52
"FidgetPicksShop:BRUNCH BREAKFAST FOOD Silicone Picking Pad - Stress and Anxiety Relief - Fidget Pick Toy - Skin Picking, Dermatillomania
Silicone Picky Pad, Fidget Pick Pad, Anxiety Relief Pad, Bead Picking Pad, Skin Picking Pad, Dermatillomania Pad, Fidget Toy, Silicone Picker Pad, Fidget Picker Toy, brunch picky pad, breakfast picky pad, waffles coffee, brunch gift",92,584,6.3,10,$26.99,$270,86
"FoxandHoundShoppe:Stress Relief Spell Jar, Anti-Anxiety & Calming Glass Wish Jar, Witchy Home Decor, Altar, Ritual, Spell Supplies, Halloween Decor
crystal shop, cheap crystals, crystal confetti, crystal scoop, glass spell jar, stress relief, handmade gift, magik spells, wiccan supplies, witch supplies, herbal crystal jar, gothic art, small gift idea",1195,1398,1.2,46,$5.50,$253,155
"AlbatrosArtStore:Healing Stress Anxiety Meditation Grounding Energy Metaphysical Gemstone Men Necklace (Black Cackle Agate & Hematite -6mm- Stone Tube Beads)
necklace, pendant, gemstone necklace, Healing necklace, Stress Anxiety, Meditation necklace, Grounding necklace, Energy necklace, men, mens",1021,435,0.4,6,$39.99,$240,15
"JoellaCraftsShop:Stress Pets Pattern Bundle/ 5 in 1 Pattern Bundle / Crochet Fidget Toy Pattern/ Crochet Stress Ball Pattern/ Crochet Animals
crochet pattern, crochet plushies, crochet patterns, crochet plush, crochet fidget, crochet fidget toy, crochet stress ball, stress ball, crochet frog, crochet pug, stress ball pattern, stress pet crochet, crochet cat",59,714,12.1,23,$9.90,$228,61
"ThePickFix:Heart Shaped Picky Pad - Stress Relief Fidget, Skin Picking Alternative
Picking Fidget, Skin Picking, Hair pulling, Compulsive picking, fidget toy, pimple popping, Anxiety Relief, picky pad, ADHD fidget, Autism fidget, skin picking relief, Dermatillomania help, bfrb",314,649,2.1,14,$15.99,$224,49
"HeyMorning:Anxiety Tracker Google Sheets Stress Tracker Spreadsheet Chronic Anxiety Management Template Anxiety Symptom Dashboard Mental Health Tracker
symptom tracker, symptom journal, symptom log, symptom diary, anxiety tracker, anxiety journal, anxiety log, Stress Tracker, Mood Tracker, Anxiety Worksheet, Chronic Anxiety, Mental Health, Trigger Tracker",265,1142,4.3,37,$5.98,$221,62
"HeavenTreasureChest:Pocket Cross Comfort Gift, Wooden Cross for Stress Relief & Encouragement, Religious Rosary Box, Christian Gift for Friend, Christmas Bible
Religious cross, Christian gift, Wooden prayer box, pocket cross gift, wooden cross gift, stress relief cross, faith encouragement, religious rosary box, gift for friend, Christmas gift, Bible study gift, comfort cross, wooden thumb cross",272,687,2.5,17,$11.99,$204,17
"DurangoMakers:8-Point Fidget Star - Fractal Stress Relief Fidget
Desk Toy, ADHD, Fidget Toy, Fidget, relaxing, Fractal, concentration, focus, Gift, stocking stuffer, stress relief, autism, anxiety relief",1033,889,0.9,29,$6.99,$203,42
"SolidGamer3D:Valorant Gekko Pop-Out Eye Stress Relief Toy, Valorant Game Desk Decor, Gift for gamers
valorant prop, valorant decor, valorant gekko gift, Stress Relief Toy, gamer gift, valorant gift, gekko toy, valorant setup",42,424,10.1,9,$19.90,$179,23
"CuriousCutes:No Sew Dog Stress Ball Puppy Crochet Pattern Animal Stress Ball Pattern  (PDF Digital Download)
crochet pattern, stress ball, stress ball pattern, easy crochet pattern, beginner crochet, no sew pattern, octopus, squishy, stress blob pattern, dog stress ball, puppy stress ball, crochet stress ball, dog toy",72,906,12.6,46,$3.75,$172,90
"johannamigurumi:CROCHET PATTERN - Phil the Frog Stress Ball | No Sew | Amigurumi Crochet Squeeze Stress Ball Plushie Pattern | Digital PDF File
crochet, amigurumi, pattern, gift, animal, plush, market, squeeze, squishy, no sew, frog, stress ball, leggy",39,790,20.3,40,$4.00,$160,94
"ARSerendipityDesigns:PDF Bubble Bass Fish Stress Ball Plush Pattern Printable Labels Tags ARSerendipityDesigns Market
pattern, crochet, bass, fishing, largemouth bass, gift, amigurumi, fish, bass fish, stress ball, plush, bubble bass, stress",45,864,19.2,44,$3.50,$154,113
"EverydayWhimtastic:Handmade rainbow beads vacuum stress relief balls for stress relief,Soft fidget toys,Sensory toys for adults,Anti-stress gel balls
Desk Stress Ball, Mochies, Stim Toy Squishy, Squishy Figet Toys, Squeeze Silicone Toy, Baby Gifts, Gifts for Boys, Gifts for Girls, Gift, Stress relief toys, Squeeze Stressball, Stress relief ball, Sensory toys",26,353,13.6,4,$37.00,$148,36
"NataliaMade:Funny Badge Reel - Stressed Possum Retractable Badge Holder, Heavy Duty Reel, Breakaway Lanyard, Carabiner, MRI Safe, Healthcare Badges
nurse badge holder, badge reel, retractable badge, interchangeable, heavy duty badge, nataliamade natalia, er icu med surge, dark humor snarky, funny gift for, nurse doctor RRT CNA, murse man men, nursing student, stressed possum",424,691,1.6,22,$6.50,$143,111
"CognicHealth:Grounding Techniques Print, Anxiety and Stress Relief, Breathing Exercises, Calm Down Mental Health, CBT, Mindfulness (DIGITAL PRINTABLE)
anxiety, mindfulness, psychology, mental health, self-care, cbt, relaxation, wall decor, grounding technique, breathing exercises, therapy worksheets, stress relief, depression",1554,698,0.4,36,$3.97,$143,71
"3CEtching:Too Blessed To Be Stressed - Engraved Stainless Steel Tumbler, Faith Mug, Blessed Gift Mug, Positivity Gift Mug
Blessed, Blessed Mug, Blessed Gift, Stress Free, Faith Based Gifts, Faith Gift, Faith Based Mug, Faith Mug, Christian Gifts, Christian Mugs, Too Blessed, Stressed, Relax",1523,285,0.2,5,$25.95,$130,11
"ThickThumbCrochet:Bunny Crochet Pattern, Stress Pet Fidget toy pdf, Cute Stress ball, Little Rabbit, Baby Bunny, Amigurimi Animal, Fun DIY Easter basket toy
Bunny Rabbit, Cute Animal, Plush Bunny, Stress ball toy, Animal Fidget toy, Stress blob, Easter fun, Spring Crochet, Amigurumi bunny, market make, fast easy crochet, Egg hunt Gift, mini plushie",45,693,15.4,35,$3.65,$128,31
"DigitalTemplateCart:50 Post Traumatic Stress Disorder Post, PTSD Instagram Template, mental health post, therapist template, social media post, life coach post
mental health canva, therapist template, life Coach template, instagram post, social media content, canva template, instagram templates, life coach post, therapist post, mindfulness post, PTSD Post, Stress Disorder, Trauma",532,532,1,27,$2.93,$79,42
"Teachwithtech:Be a schwa don't stress svg png eps jpeg language arts language help cut file - Teacher t shirt cut file silhouette cricut - Language aid
schwa png svg, be a schwa svg, schwa stress svg, dont stress svg, schwa cricut cut, schwa silhouette, language arts svg, language schwa svg, language teacher svg, language arts schwa, dont stress language, dont stress svg png, dont stress png svg",730,689,0.9,35,$2.05,$72,50
"jiggyartsncrafts:2-Pack Grape Squishy Stress Ball - Sensory Stress Ball/Decompressor for Adults/Kids
StressReliefToy, GrapeSquishyToy, Squeezeball, MeshFidgetToy",298,514,1.7,14,$4.99,$70,35
"CarvedwoodenmoCrafts:Personalized Wood Thumb Cross - Handheld Scripture Stress Relief Gift,Sensory Anxiety Fidget Toy,Religious Prayer & Easter Keepsake
Personalized Cross, Pocket Thumb Cross, Mindfulness Tool, Stress Relief Gift, Anti-anxiety Fidget, Anxiety Reducing Toy, Concentration Aid, Stress Management, Wood Fidget Toy, Handheld Prayer, Christian Comfort, Scripture Engraved, Communion Gift",17,496,29.2,13,$4.99,$65,25
"BlissValleyClassroom:Donut Stress Just Do Your Best Classroom Bulletin Board Kit | Door Decoration | Class Décor | State Testing | Finals | MAP Test | Winter
bulletin board, teacher bulletin, teacher ideas, bulletin board kit, spring bulletin, donut stress, just do your best, testing, classroom décor, end of the year, MAP test, state testing, winter",737,325,0.4,16,$4.00,$64,5
"livepaperstudio:Donut Stress Just Do Your Best SVG, Test Day Teacher Shirt Svg, Testing Svg, Gift for Teacher, School, Digital Download Png, Dxf, Eps Files
test day svg, teacher svg, teacher quotes svg, teacher gift svg, doughnut svg, donut stress, just do your best, testing coordinator, last day of school, svg files for cricut, svg for silhouette, sublimation png, state testing shirt",731,457,0.6,23,$2.40,$55,28
"SmarterNotHarder3D:Fidget Blanket - Stress Reliever!!!
fidget, toys, desk toys, work toys, adult party favor, party favor, travel toys, relaxing fun, fidgets, stress relieving, stress toys, fidget blanket, blanket fidget",46,273,5.9,9,$5.99,$54,16
"johannamigurumi:CROCHET PATTERN - Yeti and Penguin Stress Ball Pack | No Sew | Amigurumi Crochet Squeeze Stress Ball Plushie Pattern | Digital PDF File
crochet, amigurumi, pattern, animal, plush, market, squeeze, squishy, stress, ball, no sew, penguin, yeti",170,294,1.7,15,$3.45,$52,32
"HandmadebyMalCo:hot mess a little stressed sublimation design
hot mess, a little stressed, boy mom, boy momma, boy mom shirts, mom shirts, race car shirts, racing shirts, mom of boys, funny mom shirts, hot mess shirts",348,339,1,17,$3.00,$51,23
"PrintedPlaceCo:Spiral Slinky Sensory Fidget | Stress Relief | ADHD | 2 5/8 inch diameter
fidget toy, toy, fidget, stress, desk toy, spiral, slinky, adhd, fun",64,225,3.5,7,$5.99,$42,25
"SmarterNotHarder3D:Flexi Starfish Fidget, Stress Relieving
desk toy, starfish, ocean toy, fidget toy, fidgets, flexi starfish, articulating toys, 3D starfish, toys, fish, cute animals, animals, animal fidget",43,129,3,4,$9.99,$40,2
"KreationsByKoharchik:8oz mason jar 100% soy candle
mason jar, handmade, all natural, Soy candle, Christmas gift, Christmas, stocking stuffer, white elephant",1522,125,0.1,4,$9.00,$36,2
"CircaSassy:Abstract Zentangle Geometric Stress-Relief Coloring Pages for Adult, Anxiety Relief Adult Coloring Book, Instant Download 5 PDF Printables
adult coloring page, kids coloring book, adult coloring book, printable coloring, mandala coloring, abstract coloring, geometric pattern, geometric coloring, anxiety coloring, stress coloring book, pattern coloring, zentangle coloring, minimalist coloring",391,472,1.2,24,$1.42,$34,16
"LeafiaSkinCare:Stress Relief - Instantly Refresh Rose Mist - Moisturizes, Hydrates, and Cools Skin Anytime| Summer Dewy Glow. Suitable for All Skin Types
Rose body face mist, Hydrating skin spray, Dewy skin toner, Glow boost mist free, spray for travel, stress relief water, Mist for dry skin, Cooling facial spray, Self care skincare, Daily face refresh, Vegan facial mist, Natural organic skin, Makeup setting mist",34,112,3.3,2,$16.99,$34,2
"MadisHandmadeHorrors:Cute Stress Ball (green currently unavailable)
stress relief, stress ball, squishy, adorable, soft, crocheted, crochet",157,345,2.2,6,$5.00,$30,24
"RinconGitano:Stress Relief aromatherapy blend roll on  (Alivia Estrés)
stress relief, headache relief, migraine relief, eassential oil, aromatherapy, alivia estrés, Mariselherbal",2016,119,0.1,2,$14.99,$30,6
"SweetSkyDesign:All My Systems are Nervous Sticker, Stressed Sticker, Mental Health Sticker, Funny Sticker, Water Bottle Sticker, Laptop Sticker, Decal
sticker, laptop sticker, water bottle sticker, computer sticker, decals, gift, trendy, phone sticker, mental health, self love, nervous system, funny sticker, stress sticker",95,174,1.8,8,$3.50,$28,22
"FidgetPicksShop:FAIRY CORE GARDEN Mushrooms, Silicone Picking Pad, Stress and Anxiety Relief - Fidget Pick Toy - Skin Picking, Dermatillomania, adhd
Silicone Picky Pad, Fidget Pick Pad, Anxiety Relief Pad, Bead Picking Pad, Skin Picking Pad, Dermatillomania Pad, Fidget Toy, Silicone Picker Pad, Fidget Picker Toy, fairy themed gift, fairy picky pad, girl birthday gift, fairy core gift",10,92,9.2,1,$27.99,$28,19
"MysticCandleCo7:Amber glass container (9oz) candle, Gift Favors, No Stress candle, Handmade Candle, Valentine's Day Gift, Soy wax candle, Handmade Gift
Container candles, Aromacandles, Aromatherapy, Birthdaygift, soy wax candles, candle store, eco candle, best candles, aromatherapy candle, soy wax, wooden wick candle, gift best friend, Valentines gift",681,98,0.1,1,$25.99,$26,1
"TheDailyPlanners:Stress Level Tracker | Digital Planning Template | TDP TEMPLATES | Planning Inserts | Use in GoodNotes, Noteshelf or other note-taking apps
daily templates, digital templates, journal template, layout template, printable template, gratitude journal, planning insert, daily check in, mental health, mood tracker insert, Private practice, stress tracker, stress chart",290,161,0.6,5,$5.12,$26,8
"SSApparelTX:I Want To Be A SCHWA It's Never Stressed Shirt, Reading Teacher Shirt, English Teacher Shirt, Linguistic Sweatshirt, Literacy Coach Shirt
Schwa Shirt, Never Stressed Shirt, Funny Reading Shirt, Literacy Coach, Reading Teacher, English Teacher, Grammar Teacher, Reading Specialist, ESL Teacher Shirt, Linguistic Sweater, Comfort Colors Shirt, Schwa Rainbow, Linguistic shirt",26,66,2.5,1,$24.99,$25,2
"CuteGoatDesign:Smart Teacher Svg, Don't Stress Do Your Best Svg, Test Day Svg, Teacher Testing Svg, You Got This Svg, Testing Exam Svg, State Exam Svg
You Got This Svg, Test Day Svg, Rock the Test Svg, Testing Teacher Svg, Teacher Testing Svg, Testing Svg, Back to School Svg, Test Day Png, Smart Teacher Svg, Testing Exam Svg, State Exam Svg, Dont Stress Svg, Do Your Best Svg",391,143,0.4,7,$2.95,$21,12
"UpstateDesignDecor:Flexi Pets-keychains-Stress Relief – Wiggly 3D Printed Pocket Friends | Surprise Pack or Pick Your Own | Keychains Available– fidgi pets
Stress Relief, Keyhain, easter gift, Flexi Pet, st patricks day, Manatee, 3d Print, fidget keychain, fidget toy, surprise gift, pocket pet, animal gift, articulated",42,145,3.5,4,$5.00,$20,2
"3DPrintSolutionss:Stress Relief Bearing
stress, stressrelief, desk toys, bearings, toys, fun toys, stress balls, relief, toy, gift, stress bearing, 3d printed, ball bearing",291,78,0.3,2,$9.99,$20,6
