Shop / Listing,Listing Age (Days),Total Views,Daily Views,Est. Sales,Price,Est. Revenue,Hearts
"EspecialmenteFeliz:Guía Mamá sin estrés: 25 ideas para manejarlo | Guía antiestrés para mamás | Actividades antiestrés para mamá | Tarjetas Autocuidado materno
Mamá feliz, Calma y paz, Bienestar de mamá, Madres, Bienestar familiar, Guía Antiestrés, Actividades Relajantes, Autocuidado materno, Mamá en calma, Familia feliz, mamá sin estrés, reducir el estrés, Ideas antiestrés",508,48,0.1,1,$17.00,$17,0
"EverythingAmyzingCo:Stressed Blessed and Dog Obsessed svg, Dog svg, Pet svg, Dog Mom svg, Fur Baby svg, Puppy, Cricut svg, Silhouette svg, svg, png, eps, dxf
dog svg, dog mom svg, stress svg, blessed svg, pet svg, fur baby svg, fur baby, paw print svg, anxiety svg, pet loss svg, dog, puppy, Pet Love",1189,120,0.1,6,$2.39,$14,23
"MattiesMelts:Car diffuser, Hanging Car Diffuser, fragrance for small spaces, variety of scents, handmade. Air freshener, handmade
home decor, essential oil, Strong scents, Odor control, Fragrance oil, clean car, scents small spaces, air fresheners, hanging car diffuser, car fresheners, oil car diffusers",534,56,0.1,1,$8.85,$9,1
"AlisonGilbrook:Adorable little sets, stress ball and baby worry worm, anxiety ball, soft, velvet, pocket pal, fidget toy, desk pal, physical therapy
mental health, stress ball, desk pal, pocket stress ball, crochet stress ball, anxiety ball, gift, crochet, stress reliever, students, anxiety, baby worry worm, physical therapy",82,42,0.5,1,$8.00,$8,2
"AshleyPaintsArts:Flower doodles, anxiety relief, stress relief, coloring page, instant download, printable
flower doodles, coloring book, coloring page, stress relief, anxiety relief, coloring, art, digital download, printable, adult coloring, fun, mental health, flowers",394,87,0.2,4,$1.00,$4,1
"djbora:Relax Meditation S2 - Background Stress relief, Instrumental royalty free music
motivation, ambient, Meditation, mood, Sleep music, Nature sounds, royalty free music, Stress relief, background, Instrumental Music, zen therapy, slow music, yoga",51,25,0.5,1,$3.99,$4,0
"CrowsArtCorner:Stress and Anxiety relief Reverse Coloring Book: Nature Edition
reverse coloring, adult coloring, nature coloring, stress free, anxiety relief, art therapy, color relaxation, diy coloring, reverse art, calming therapy, artsy",19,39,2.1,2,$1.92,$4,1
"AlynnaStudio:CoCo Wyo Stress Relief Coloring Book for Adults and Kids – 52 Bold Easy Designs (Animals, Flowers, Patterns, Digital Download)
cute and cozy, cute and comfy, bold and easy, coco wyo, coloring book, digital coloring, adult coloring, Stress Relief Color, Stress Relief, coco wyo Stress, coco wyo coloring, Bold Coloring Book, Easy Coloring Pages",6,34,5.7,1,$3.00,$3,1
"KeeKruCreations:Feeling Stressed? Let it Go, Let it Go! Family Activity Window Display
Family, Activity, Window, Display, Quarantine, Fun, Unique, Neighbors, Sign, Frozen, Elsa, Stress",1718,34,0,1,$2.00,$2,0
"HsdStudio:Mom Stressed, Blessed, Devoted,  Sometimes A Mess Svg, Mom Life Svg, Funny Mom Svg File for Cricut, Girl Mama Png, Boy Mom Shirt Svg, SVG
Mom Stressed, Blessed, Devoted, Sometimes A Mess Svg, Mom Life Svg, Girl Mama Png, Boy Mom Shirt Svg, SVG, Funny Mom Svg, mom gift svg, mothers day svg, mama svg, Mom Shirt Svg",1105,28,0,1,$1.44,$1,0
"EllieMorganBooks:Stretch Marks are from Stress Eating. Thanks, Adoption. -- card with envelope, handmade card, card for adoption, funny adoption card
funny card, stretch marks, stress eating, adoption struggles, waiting to adopt, foster care, adoption parents, adoption, handmade card, card for adoption, adoption done, adoption humor, handmade",1964,16,0,0,$5.85,$0,1
"VintageVibeusDesigns:Rock The Test Png, Don't Stress Just Do Your Best, Test Day Teacher Png, STAAR Day Png, Testing Png, Last Day Of School, Preppy Testing Day
Teacher Appreciation, Don't Stress Png, Do Your Best Png, test day sublimation, Test Score Png, Teacher Life Png, You Got This Png, Test Day Png, Rock The Test Png, Teacher Test Day Png, Gift For Teacher, staar tesing day png, teacher life student",1,0,0,0,$2.09,$0,0
"BlueBearGiftCo:Funny Mug Hike More Stress Less Mug Gift for Hiker Gift for Campers Hiking Gift Funny Hiking Mug Inspirational Hiking Gift Motivational Gift
Hiker mugs, Hike More mugs, stress less mugs, camp mugs, hunting mugs, hiker gifts, outdoorsy gifts mugs, camp gifts, birthday gifts, Christmas gifts, outdoors gifts, Father's day gifts, Mother's day gifts",617,11,0,0,$15.99,$0,0
"ShopExile:Vintage Stressed Cat Shirt Not Nearly As Calm As I Look 90s Graphic T Shirt 1990s Joke Funny Animal Tee Shirt Single Stitch Large
women, cat tshirt, graphic shirt, men, cat t shirt, graphic tshirt, graphic t shirt, cat tee, stressed shirt, 25JAN05 hlyx, 90s cat t shirt, stressed cat tee, stress shirt",1,0,0,0,$68.00,$0,0
"AngelasAtticandCo:Dear Stress, I'm Breaking Up With You T-Shirt
Stress, Me, You, Breaking Up, T-Shirt",1841,12,0,0,$23.00,$0,0
"LunarFlarestudio:Stress Relief Adult Anxiety Word Search - Digital Download 32 Word Searches with Solutions
word search, stress relief, printable, adult activity",122,4,0,0,$5.00,$0,0
"VRNprintgiggles:Overcome Anxiety, Fear, and Stress E-book – Faith-Based Guide for Peace and Confidence – One Step at a Time, You’ll Get There
anxiety relief ebook, christian self help, faith based healing, mental health guide, stress relief guide, overcome fear, overcome anxiety, emotional wellness, daily encouragement, spiritual healing, one step at a time, peaceful mindset, faith anxiety help",1,0,0,0,$7.99,$0,0
"RedWing3dCreations:Rhombo Fidget Ball - ADHD Stress Relief and Focus Tool, Anxiety Reducer, Fun Office Toy, Sensory Play for Kids & Adults
fidget ball, fidget toy, stress relief, anxiety relief, fidget rhombo ball, stress relief tool, unique fidget item, cozy anxiety relief, kids sensory play, gear ball, adhd stress ball, 3d print, fidget gadget",122,20,0.2,0,$12.00,$0,0
"ChristiansenDesigns:Surviving Stress: Quick Start Kit | Printable Mental Wellness Journal | Self-Care Workbook | Instant Download PDF
stress relief, self care kit, calm workbook, mental health, quick start guide, wellness journal, printable pdf, self help printable, instant download, stress kit, anxiety tools, relaxation guide, reflection prompts",1,0,0,0,$9.99,$0,0
"hayleyzammit:Spiritually Soothe Stress & Anxiety Meditation Script / 585 words / for business or personal use
spirituality, spiritually soothe, stress anxiety, meditation script, guided meditation, scripted meditation, business use, digital download, PDF, meditation teacher, meditation guide, divinity, spiritual healing",251,7,0,0,$11.00,$0,1
"MalkiaMagic:Tranquil Essence 8oz Candle
",892,10,0,0,$15.00,$0,0
"GreenPath3D:Small Fidget Shuriken Keychain 3D Printed Stress Relief Toy, Unique Gift for Men & Teens Keyrambit Shurikey Ninja Star
Unique Gift Men, Gift for Teens, Fidget Karambit Toy, 3D Printed Keychain, Men's Fidget Gift, Karambit Fidget Key, Stress Relief Toy, Gift for Fidgeters, Fidget Toy Keychain, Men's Stress Relief, Shuriken Keychain, Novelty Ninja Star, Shurikey Fidget Toy",1,0,0,0,$8.50,$0,0
"HealingWindsReiki:Reiki Charged Carnelian Chip Bracelet -  Stress Relief, Motivation, Self Confidence - New Age Gift, Metaphysical Jewelry, Stretch Bracelet
Reiki Charged, Carnelian Bracelet, Charged Carnelian, Reiki Carnelian, Carnelian Chip, New Age Carnelian, Burnt Orange Jewelry, Stress Relief, Motivation Bracelet, New Age Gift, Metaphysical Jewelry, Stretch Bracelet, Self Confidence",2349,0,0,0,$16.95,$0,24
"Lobnacreationstudio:Ultimate Coloring Book / Digital Print / Stress Relife / Dreamy Design / Creative Creature / Peaceful Patterns / Printable /Magical Coloring
Art Prints, Coloring Book, Digital Book, Printable, Instant Download, creative art therapy, mindful coloring, stress relief color, imaginative colors, detailed line art, Family Activity Time, joyful color time",1,0,0,0,$4.00,$0,0
"TeeTimeShirtShack:Donut Stress Test Digital File | Donut Stress Test Png | Testing Day Shirt | Testing Quotes | Teacher DIY Shirt | Cricut | Silhouette Cameo
SVG, PNG, Cricut, Silhouette Cameo, Trendy, Funny Shirt, Test Day Shirt, School Testing Shirt, Testing Coordinator, School Testing, Motivational Shirt, Donut Stress Test T, Donut Stress Shirt",1,0,0,0,$2.00,$0,0